{
  "$schema": "https://json-schema.org/draft/2020-12/schema",
  "$id": "SyntheticJobConfigRun.schema.json",
  "title": "SyntheticJobConfigRun",
  "description": "계약 승격용(CR-008 초안에서 정리, 2026-10-29). `python -m synthetic_data run --config <파일>`의 설정. 만드는 쪽: deploy 스케줄러(e2e 설정) 또는 개발자. 읽는 쪽: synthetic_data/config.py parse_config. 모르는 키 정책: 거부(ADR 0014). 현재 코드는 최상위만 거부하고 중첩 객체의 모르는 키는 무시한다; 이 초안은 중첩도 거부하는 제안이다(안전 설정이 기본값으로 조용히 돌아가는 것을 막는다는 ADR 0014와 같은 이유).",
  "type": "object",
  "additionalProperties": false,
  "required": [
    "dataset_id",
    "seed",
    "survey_schema_dir",
    "adapters",
    "question_sets",
    "split",
    "output"
  ],
  "properties": {
    "_comment": {
      "type": "string"
    },
    "dataset_id": {
      "$ref": "_common.schema.json#/$defs/Id"
    },
    "seed": {
      "type": "integer",
      "description": "같은 입력과 시드는 같은 결과(멱등). bool은 거부."
    },
    "created_at": {
      "$ref": "_common.schema.json#/$defs/Timestamp",
      "description": "매니페스트 created_at(UTC Z). 생략하면 실행 시각. --created-at 인자가 우선. 코드는 형식을 검사하지 않고 DatasetManifest 게시 때 검증된다."
    },
    "version": {
      "type": "string",
      "description": "생략하면 digest에서 만든다(v + digest 앞 32자리, 128비트, 2026-10-29 ADR 0006 보강). 문자 규칙은 _common Id.",
      "allOf": [
        {
          "$ref": "_common.schema.json#/$defs/Id"
        }
      ]
    },
    "action_rules_version": {
      "type": [
        "string",
        "null"
      ],
      "description": "계약 ActionExtractionRules.rules_version(LoRA-A 출력 규칙의 세대). 3.0.0에서 turn_engine_version을 대체(D109): 규칙의 정본은 계약 데이터다."
    },
    "survey_schema_dir": {
      "type": "string",
      "minLength": 1,
      "description": "문진 스키마 디렉터리. 상대 경로는 설정 파일 위치 기준. SD-07은 이 CR 범위 밖."
    },
    "adapters": {
      "type": "object",
      "additionalProperties": false,
      "required": [
        "question_reader"
      ],
      "properties": {
        "question_reader": {
          "$ref": "#/$defs/Adapter"
        },
        "failure_store": {
          "$ref": "#/$defs/Adapter"
        }
      }
    },
    "question_sets": {
      "type": "array",
      "minItems": 1,
      "items": {
        "type": "object",
        "additionalProperties": false,
        "required": [
          "id"
        ],
        "properties": {
          "id": {
            "type": "string",
            "minLength": 1
          },
          "version": {
            "type": "string"
          },
          "usage": {
            "enum": [
              "TRAIN_POOL",
              "HELD_OUT_EVAL"
            ],
            "default": "TRAIN_POOL"
          }
        }
      },
      "description": "불변식(코드가 검사, 스키마로는 표현 못 함): 같은 id를 TRAIN_POOL과 HELD_OUT_EVAL에 함께 쓰지 않는다."
    },
    "reviewed_only": {
      "type": "boolean",
      "default": true
    },
    "seeds": {
      "type": "object",
      "additionalProperties": false,
      "properties": {
        "enabled": {
          "type": "boolean",
          "default": false
        },
        "question_set_id": {
          "type": "string"
        },
        "max_pii_suspect_rows": {
          "type": [
            "integer",
            "null"
          ],
          "minimum": 0,
          "description": "시드의 입력·정답에서 개인정보 의심 패턴이 있는 사례 수의 허용치. 생략하면 0(하나라도 있으면 실행 거부), null이면 경고만(ADR 0005 보강)."
        }
      },
      "description": "불변식(코드가 검사): enabled=true이면 adapters.failure_store가 있어야 하고, question_set_id는 question_sets에 있어야 한다."
    },
    "split": {
      "type": "object",
      "additionalProperties": false,
      "required": [
        "ratios"
      ],
      "properties": {
        "ratios": {
          "type": "object",
          "additionalProperties": false,
          "required": [
            "TRAIN",
            "VALIDATION",
            "EVAL"
          ],
          "properties": {
            "TRAIN": {
              "type": "number",
              "minimum": 0
            },
            "VALIDATION": {
              "type": "number",
              "minimum": 0
            },
            "EVAL": {
              "type": "number",
              "minimum": 0
            }
          },
          "description": "합이 0보다 커야 한다(코드가 검사). 값은 사용자 결정(O11)이며 예시 값은 동작 확인용 자리 표시."
        }
      }
    },
    "review": {
      "type": "object",
      "additionalProperties": false,
      "properties": {
        "per_kind": {
          "type": "integer",
          "default": 2,
          "minimum": 0
        }
      }
    },
    "regeneration": {
      "type": "object",
      "additionalProperties": false,
      "properties": {
        "mode": {
          "enum": [
            "full",
            "affected_only"
          ],
          "default": "full"
        }
      }
    },
    "output": {
      "$ref": "SyntheticDefs.schema.json#/$defs/Output"
    }
  },
  "$defs": {
    "Adapter": {
      "description": "이웃 읽기 클라이언트를 만드는 방법: 파이썬 `module:function` 문자열(factory)과 kwargs. 토큰은 kwargs의 token_env(비밀 이름)로만 받고 값은 read_secret(NAME_FILE 우선)이 읽는다(D84). CR-008 초안이 제안한 kind:http 형식은 코드에 없어 이 승격본에서 뺐다(받아들일지는 헤드 결정, SD-05).",
      "type": "object",
      "additionalProperties": false,
      "required": [
        "factory"
      ],
      "properties": {
        "factory": {
          "type": "string",
          "pattern": "^[^:]+:[^:]+$"
        },
        "kwargs": {
          "type": "object"
        }
      }
    }
  }
}
